,title,description,video_id
1210,10 TOP THINGS BARBERS HATE REACTION,Follow me on Instagram: https://www.instagram.com/360jeezy/ To Purchase The Tools I Use In This Video: Oster Fast Feed: http://amzn.to/2DhZ4ir Andis GTX: ...,0JWu5vNpqyQ
1211,✂️💈 BEST BARBER IN THE WORLD 2018 U.S.A / Videos Compilation Styles for Men's,BEST BARBER IN THE WORLD 2018 U.S.A / Videos Compilation Styles for Men's - Thanks for subscribing!! LIKE & SHARE . Turn on the notification bell to be ...,uvs82RGOQg4
1212,Best Barbers in The World ★ Amazing Barbers Skills Compilation #107,Arefni market on Amazon https://www.amazon.com/shop/influencer-60da0a01 The Barbers in this video : @shelwinijafet Seminarian and Professional Educator ...,EevMOBMQeC0
1213,Best Barbers in The World ★ Oddly Satisfying Barbers Skills #101,Arefni market on Amazon https://www.amazon.com/shop/influencer-60da0a01 Will be happy when you visit our shop https://teespring.com/arefni @dratillakaya ...,1VbQZBNzvRw
1214,Best Barbers in The World /Barbershop U.S.A 2018/ Haircut Hairstyle,Subscribe / Share / Comment / Like / buy products that have been in the video from amazon.es / HERE : http://amzn.to/2y0lXbT Download music from the video ...,Ke0ufcsbyvU
1215,Best Barbers in The World ★ Cool and Popular Hairstyle #69,Enjoy With Amazing Barber Skills Track: Cartoon - On & On (feat. Daniel Levi) [NCS Release] Music provided by NoCopyrightSounds. Watch: ...,JqswT5jFD-w
1216,Best Barbers in The World 🌍💈 Crazy Barber Skills 🔥,"Subscribe and activate the ""  "" to make sure that you will never miss any VIDEO! Music: Track: Andromedik - Titan [NCS Release] Music provided by ...",bLBZhXBrdsk
1217,BARBERS GONE WILD REACTION 16,Follow me on Instagram: 360Jeezy https://www.instagram.com/360jeezy/ Channel Donations: https://www.paypal.me/360Jeezy To Purchase The Tools I Use In ...,mudrN8kj1JE
1218,"Virtual Barber Shop (Audio...use headphones, close ur eyes)","You'll need headphones for this to work. Make sure there is no noise around, close your eyes, turn the volume up a little bit, hold and press headphone on your ...",IUDTlvagjJA
1219,✂️💈 BEST BARBER IN THE WORLD 2018 U.S.A / Videos Compilation Styles for Men's,BEST BARBER IN THE WORLD 2018 U.S.A / Videos Compilation Styles for Men's - Thanks for subscribing!! LIKE & SHARE . Turn on the notification bell to be ...,ee18t10ZNUM
1220,Best Barbers in The World ★ Amazing Barbers Skills Compilation #100,Arefni market on Amazon https://www.amazon.com/shop/influencer-60da0a01 Will be happy when you visit our shop https://teespring.com/arefni The Barbers in ...,uaYDtVOhzEQ
1221,Two Barbers One Cut,Shop Beardbrand: https://bdbd.us/2sJsFxx Instagram: https://www.instagram.com/beardbrand Twitter: https://www.twitter.com/beardbrand DESCRIPTION Two ...,0za4XMq9W8U
1222,✂️💈 BEST BARBER IN THE WORLD 2018 U.S.A / Videos Compilation Styles for Men's,BEST BARBER IN THE WORLD 2018 U.S.A / Videos Compilation Styles for Men's - Thanks for subscribing!! LIKE & SHARE . Turn on the notification bell to be ...,NgfIaIWBeIM
1223,The Most Beautiful Barbers in The World ★ Best Barbers Compilation 2018,"Have a Nice Time enjoy Amazing and Beautiful Women Barber Skills and Hair styles of cute kids, boys & men. * SUB 4 More! Songs: 1. 3rd Prototype ...",QTe2YR8qbp0
1224,Amazing Barber Skills ★ Best Videos Barbers Compilation ★ Best Workers #18,Have a Nice Time With Amazing Barber Skills Song: Culture Code - Make Me Move (feat. Karra) [Tobu Remix] | NCS Release Music provided by ...,TyV2LT76s7o
1225,Best Barbers in The World /Barbershop U.S.A 2018/ Haircut Hairstyle,Subscribe / Share / Comment / Like / buy products that have been in the video from amazon.es / HERE : http://amzn.to/2y0lXbT Download music from the video ...,8I-2MvJCQlQ
1226,✂️💈 BEST BARBER IN THE WORLD 2018 U.S.A / Videos Compilation Styles for Men's,BEST BARBER IN THE WORLD 2018 U.S.A / Videos Compilation Styles for Men's - Thanks for subscribing!! LIKE & SHARE . Turn on the notification bell to be ...,E2MdRT-RCns
1227,BEST MEN HAIRCUTS & BARBER SKILLS COMPILATION,"Subscribe and activate the ""  "" to make sure that you will never miss any VIDEO! Music: Electro-Light - Symbolism ...",3LMrmWOPP3I
1228,Necessary Tools For Beginner Barbers,Het Beginner Barbers made this one especially for you! If you are confused on how to start this is a great video to help you! Instagram: Thebarberstable ...,qb11ZCUBZ-g
1229,BARBERS GONE WILD 18,Follow me on Instagram: 360Jeezy https://www.instagram.com/360jeezy/ BEATS HustleDreamProduction Youtube Channel: ...,tfCvzTZ0WK4
1230,Best Barbers in The World ★ Amazing Barbers Skills Compilation #97,Arefni market on Amazon https://www.amazon.com/shop/influencer-60da0a01 The Barbers in this video : @Mustafa_polatogluu Mustafa Polatoglu Mevlana halit ...,dpEMCu1ExPY
1231,Funny Hairline Fails | Best Barbers Skills In The World | Barber Fails Designs Hairstyles Haircut,Watch New Video: Funny Hairline Fails https://bit.ly/2RS458Z Here are some of the funniest and worst hairlines i've ever seen Funny Hairline Fails Best Barbers ...,nNHKImAJj8k
1232,Best barbers in the world /barbershop U.S.A 2018,Subscribe / Share / Comment / Like / buy products that have been in the video from amazon.es / HERE : http://amzn.to/2y0lXbT Copyright Disclaimer: I do not ...,X1NAH4r0Mew
1233,BARBERS GONE WILD REACTION 15,Follow me on Instagram: 360Jeezy https://www.instagram.com/360jeezy/ To Purchase The Tools I Use In This Video: Clippers: Andis Cordless T Outliner: ...,pcuyGPUS_Z4
1234,BARBERS GONE WILD REACTION 2,Follow Me on Instagram: https://www.instagram.com/360jeezy/ To Purchase The Tools I Use In This Video: Oster Fast Feed: http://amzn.to/2DhZ4ir Andis GTX: ...,r1OfD9PV8cY
1235,Best Barbers in The World ★ Amazing Barber Skills Compilation #48,Have a Nice Time With Amazing Barber Skills Track: Raven & Kreyn - So Happy [NCS Official Video] Music provided by NoCopyrightSounds. Watch: ...,YnoAiKrVY3c
1236,✂️💈 BEST BARBER IN THE WORLD 2018 U.S.A / Videos Compilation Styles for Men's,BEST BARBER IN THE WORLD 2018 U.S.A / Videos Compilation Styles for Men's - Thanks for subscribing!! LIKE & SHARE . Turn on the notification bell to be ...,IOl5y369lyE
1237,CRAZY BARBERS GONE WILD REACTION 9,Follow me on Instagram: 360Jeezy https://www.instagram.com/360jeezy/ To purchase Beats/Instrumentals Email: HustleDreamProduction@gmail.com.,Rd84tySwIZc
1238,Best Barbers in The World ★ Amazing Haircut Designs and Hairstyles # 104,Arefni market on Amazon https://www.amazon.com/shop/influencer-60da0a01 Will be happy when you visit our shop https://teespring.com/arefni The Barbers in ...,ReNrtrZj508
1239,Best Barbers in The World ★ Amazing Barbers Skills Compilation ★ Hair Transplant #95,The Barbers in this video : @Barberobengie Bengie Barbero @hagopart Hagopart Barbershop Member of @officialbarbersleague Address : Adonts 9 St (Yeraz ...,GkNf27qsXhc
1240,Funniest Barbershop Videos Of August 2016💈😂✂️.,Enjoy another month as we clown around about what goes on a daily basis at the barbershop.,THr6qCtQcCA
1241,Kid Tries To Cut His Own Hair Barber Saves The Day,"Here is a Tutorial by A ROD @arod23pr performing a Kids Hair Transformation . I hope you enjoy this video , give me thumbs up & comment below what you ...",UPP4Gvtl2oM
1242,BARBERS GONE WILD REACTION 13,Follow me on Instagram: 360Jeezy https://www.instagram.com/360jeezy/ To Purchase The Tools I Use In This Video: Clippers: Andis Cordless T Outliner: ...,yuttWoGtwfg
1243,My First Haircut in 5 Months | South Austin Barber Shop,Shop Beardbrand: https://bdbd.us/2RXsKJc Instagram: https://www.instagram.com/beardbrand Twitter: https://www.twitter.com/beardbrand DESCRIPTION Jack ...,fNBPVlnrd1A
1244,Best Kids Haircuts by Best Barbers in The World #4,"Subscribe and activate the ""  "" to make sure that you will never miss any VIDEO! Songs: Veorra - The City https://www.youtube.com/watch?v=tHDmgS0ViaQ ...",gV8Zw1qOR4o
1245,Cholo Barber Ruins Barbershop,Arod a barber and barbershop owner hires a CHOLO barber (@dinerocutz) that Takes Over the entire barbershop and trains all the barbers to be drug dealers ...,n0xK7irl6Tk
1246,BARBERS GONE WILD REACTION 3,Follow me on Instagram: https://www.instagram.com/360jeezy/ To Purchase The Tools I Use In This Video: Oster Fast Feed: http://amzn.to/2DhZ4ir Andis GTX: ...,AAIrAfK4D78
1247,✂️💈 BEST BARBER IN THE WORLD 2018 U.S.A / Videos Compilation Styles for Men's #18,BEST BARBER IN THE WORLD 2018 U.S.A / Videos Compilation Styles for Men's #18 - Thanks for subscribing!! LIKE & SHARE . Turn on the notification bell ...,L1qHzUWRR4E
1248,THE BEST BARBER IN THE WORLD ! BEST HAIRCUTS COMPILATIONS ! E.P#86,THE BEST BARBER IN THE WORLD ! BEST HAIRCUTS COMPILATIONS ! E.P#86 Like us on facebook! https://www.facebook.com/menhairdos Follow us on ...,Qvq__10qYTg
1249,Amazing Barber Skills Compilation 2018 - Incredible Hair Art Designs - Best Barbers In The World,"Amazing Barber Skills Compilation 2018 - Incredible Hair Art Designs - Best Barbers In The World - Watch, rate, share and Comment - Please leave a like if you ...",yXWE0vurSgg
1250,Cutest Holiday Pets Compilation 2018 | Funny Pet Videos,"It's time for the holidays, and what else could be better than watching some of the funniest and cutest pets ready for the holiday season! We love to bring you the ...",IjskxZPOyDg
1251,"Thinkercon,  Meet My Pets and Mail-time!","If you want to learn about sculpting or just learn something new, please check out Skillshare. The first 500 people to use my link will get 2 months free!",WvpId7G2SgQ
1252,*NEW* NIGHTMARE PET EGG AND TRADING PETS IN BUBBLE GUM SIMULATOR UPDATE!! (Roblox),NEW* NIGHTMARE PET EGG AND TRADING PETS IN BUBBLE GUM SIMULATOR UPDATE!! (Roblox) SUBSCRIBE For More Videos!,QskbwQOOS0M
1253,Apro la BIGGIE PETS più PUCCIOSA del mondo!,"Ciao Dolci Unicorni! Oggi apro la seconda Biggie Pets, quella di Hop Hop, la cucciola di Bon Bon! È troppo pulciosa COMPRA IL LIBRO ""LA VITA SEGRETA ...",Wi-532YbbLU
1254,BABY PETS 🐞 Kira the Cat Dresses up as Ladyubug | Cartoons for Children,"Hi, guys! In today's new gameplay video on ToonToon Games we are going to dress up our baby pet Kira as Miraculous Ladybug!! Baby Alex and Lily, and Max ...",3o4pJTnRR28
1255,""" The Secret Life Of Pets  2 ""  Trailer - Full Version Hd",""" The Secret Life Of Pets 2 "" Trailer - Full Version Hd characters for this movie : Max , Snowball , Gidget , Duke , The Flushed Pets , Chloe , Tiberius , Ozone The ...",8MweBJA6gfQ
1256,Update! Trading! Got New Best Pets & New Flavors! Dark Serpent and More!! - Bubble Gum Simulator,New Update! Trading! Getting Best Pets & New Best Flavors! - Bubble Gum Simulator Instagram: @mayrushartyt https://www.instagram.com/mayrushartyt/ ...,aLIiacKYNEk
1257,MEGA UPDATE NEW NIGHTMARE EGG EPIC PETS | Roblox Bubble Gum Simulator,Subscribe for free!: https://www.youtube.com/channel/UCWdh9h_W2A4XKcLYdmD0ijg?sub_confirmation=1 ▷   Subscribe to Ashleyosity!,NFznFt4g9M0
1258,HUGE CAT VS 200 DARK MATTER PETS! | Roblox Pet Simulator,Huge cat vs 200 dark matter pets (all tier 18) on the dominus chest in Roblox Pet Simulator! PREVIOUS EPISODE ...,y2p19tcISH8
1259,"SEASON 7 BATTLE PASS! - SKINS, PETS, MAP UPDATE, RELEASE DATE and MORE! (Fortnite Battle Royale)",The Fortnite Season 7 Battle Pass is going to be amazing! ▻SEASON 7 BATTLE PASS GIVEAWAY : https://gleam.io/uUODX/season-7-battle-pass-giveaway ...,O5qrzfzFwys
1260,WTF IS THAT?! | Confused Pets Compilation,"Hooman, wut in the heck is goin on here?! The Pet Collective is home to the top trending clips, most entertaining memes, and funniest animal videos online.",wV1MNIhhth0
1261,"LOL Surprise seria 4 Eye Spy • Otwieram wszystko: KAPSUŁA, PETS, LIL SISTERS","LOL Surprise seria 4 Eye Spy • Otwieram wszystko: KAPSUŁA, PETS, LIL SISTERS • Najlepsze bajki dla dzieci zobaczysz na BajkowoTV. • Jeżeli szukasz ...",EMWvAfGYxmU
1262,MEET ALL 29 OF MY PETS!!,Hope you all enjoyed the video!! Comment any videos you guys want to see!,5IdgvHzMy28
1263,Tik Tok Pets: Funny Cute Animals #34,"Tik Tok Pets: Funny Cute Animals #34 Video funny pets tik tok dog, cat, animals,.... Thanks for watching!",huUXkGju9J8
1264,Tik Tok Pets: Funny Cute Animals #35,"Tik Tok Pets: Funny Cute Animals #35 Video funny pets tik tok dog, cat, animals,.... Thanks for watching!",2FUpF5zmjr4
1265,"Feed Your Pets, Misiones Secretas Escondidas en la Jungla y Colmena, Roblox Español Guía Tutorial 3","Feed Your Pets, Misiones Secretas Escondidas en la Jungla y Colmena, Roblox Español Guía Tutorial 3 Prepárate para este juegazo de cazar mascotas más ...",U4uLIG7LnSI
1266,5 अटपटे पालतू जानवर 5 Most Unusual Pets,5 अटपटे पालतू जानवर 5 Most Unusual Pets हमारे हिसाब से तो ये एक्सोटिक एनिमल्स को पेट बना...,TFjYNAdtfd8
1267,10 Pets Who Killed Their Owners   Top 10 Deadly Attacks From Exotic Pet Animals,"10 Pets Who Killed Their Owners Top 10 Deadly Attacks From Exotic Pet Animals An exotic pet is a unusual animal pet, kept within human households which is ...",K7QzbY3Xlf0
1268,Meet All 79 Of My Pets,Meet all of my pets! I counted them. It's actually less than I thought! Meet all 24 of my pigs here: https://youtu.be/vBeBJXBY2nk ********** Subscribe: ...,xhel7UG8gHI
1269,13 Amazing Pets Who Saved Their Owners,Pets can be very loyal and in some cases they are able to save their owners life when something bad happened to them. Here are some pets who saved their ...,bMwLm16_Q-0
1270,I GOT 2 GODLY PETS IN MONSTER BATTLE SIMULATOR!! *BEST PETS* (Roblox),I GOT 2 GODLY PETS IN MONSTER BATTLE SIMULATOR!! *BEST PETS* (Roblox) SUBSCRIBE For More Videos! youtube.com/russoplaysgames MERCH ...,9dKv61gXjBo
1271,Secret Life of Pets Bath Tub Time Finger Paint Soap with Toy Surprises,"Secret Life of Pets Bath Tub Time Finger Paint Soap with Orbeez, Toy Surprises & Bubbles | Toys Unlimited Like, comment, share! Please SUBSCRIBE to our ...",iaROo8im2cs
1272,"ALL OF MY PETS IN ONE VIDEO (I know, I have a lot)",GET NALA THE HEDGEHOG AND CHEESE MERCH NOW: https://shop.studio71us.com/collections/taylor-nicole-dean/ --------------------------- I kept putting off ...,wRpvm3B5Ocg
1273,10 Pet Animals That ATE Their Owners,"Hey YouTube, Jim here! Welcome to Top10Archive! Do you have a pet that you entrust with your life, an animal that's been faithful to you for years? Maybe a dog ...",9zsPF99Mims
1274,Funniest Confused Pets Compilation 2018 | Funny Pet Videos,"We love to bring you the best videos on the internet! Everything from Funny Videos, Fails, Fail Videos, Funny Baby Videos, TNTL Challenge, Si Te Ries Pierdes, ...",UDEN_aDkWLA
1275,8 Pet Animals That Ate Their Owners,"Animals, especially wild animals which people treat are pets can turn on their owners really quickly when treated badly or even at random. These pets all ...",q27V7_PzYxU
1276,Amazing  💥 10 Pets Who Saved Their Owners Lives  💥 Real Life Heroes,Hope You Like This Video !!!,cVOHEUnRAGg
1277,Answering Your Questions (pets & lifestyle),Answering Your Questions (pets & lifestyle) ------------------------------------------------------------------------------------------------------------ ✿ Social Media ✿ Instagram ▻...,I7e-B7AdZWI
1278,Max from The secret life of pets movie Stop motion play doh clay cartoon,Baby Hulk loves milk Superhero Play Doh Stop motion cartoons https://www.youtube.com/watch?v=pZL-wHsoVUI Sand Snowman Paw Patrol Superhero ...,rn9SQYmAb_4
1279,Most EXPENSIVE Pets In The World!,"Check out the most expensive pets in the world! From the most expensive dog breed to some other bizarre but amazing animals, this top 10 list of expensive pets ...",MRaJoifz6SY
1280,Best Pets of the Month | November 2018,This month we are thankful for these very good bois  . The Best Pets of the Month | November are finally here!! The Pet Collective is home to the top trending ...,h082kbz3drM
1281,*NEW* Nightmare Eggs + Lucky Chances and 500 Pets (CODES) Roblox Bubble Gum Simulator,Roblox Bubble Gum Simulator Codes *NEW* Nightmare Eggs + Lucky Chances and 500 Pets Roblox Video: Today we return to this epic roblox simulator and ...,Ykfq6r10hU0
1282,The Secret Life Of Pets Giant Golden Toys Surprise Egg Opening Fun With Ckn Toys,"Hi guys, today we are SMASHING open this Secret Life Of Pets super giant golden surprise egg.In this giant toys surprise egg there are many cool toys from the ...",gdEW3Vavn-M
1283,People Share 66 Hilarious Habits Their Pets Have And They’re Too Good,"People Share 66 Hilarious Habits Their Pets Have And They're Too Good We've seen dogs being weird and pets bringing home the weirdest of items, so it's ...",HhSX647yOuw
1284,I Purchased Halloween Costumes for My Pets,dressing up some of my pets for halloween hope you enjoyed even though it was a MESS hahaha. I tried. check out my merch!,2GPBQ-6A6qM
1285,10 Exotic Animals You Can Keep as Pets at Home,"How to keep an exotic pet. It can be a skunk, a fennec, or even a capybara. Above all, it'll cost you quite a lot of money and effort to take care of one of those ...",aqK4qRK0nRA
1286,People Share 66 Hilarious Habits Their Pets Have And They’re Too Good,"People Share 66 Hilarious Habits Their Pets Have And They're Too Good ❄ We've seen dogs being weird and pets bringing home the weirdest of items, so it's ...",jJKqYch_yB0
1287,First Impressions & Making My Pets | The Sims 4 YouTuber Pets | Episode 1,Hey guys and welcome to my first ever video on The Sims 4 Cats and Dogs. Today I'm starting a new series where I create YouTuber pets and play with them!,AXBVOSPkdfE
1288,Cutest Fluffy Pets Ever 2018 | Funny Pet Videos,"Are you ready for the fluffiest pets ever? We love to bring you the best videos on the internet! Everything from Funny Videos, Fails, Fail Videos, Funny Baby ...",R0qW_Tqetnw
1289,ROBLOX PET SIMULATOR NEW POSSESSED *RARE* PETS HELP!! [UPDATE 12] (giveaway),ROBLOX PET SIMULATOR *POSSESSED* RARE PET!!! [UPDATE 12] (giveaway) MY PET IS HAUNTED!!! HELP!! ▷ Subscribe Today : http://bit.ly/2Ax0cSH ...,2psp0Hcs--E
1290,NEW WINTER UPDATE! FREEZEVILLE! NEW PETS AND HATS! ROBLOX ICE CREAM SIMULATOR,NEW WINTER UPDATE! FREEZEVILLE! NEW PETS AND HATS! ROBLOX ICE CREAM SIMULATOR ▻ Twitter ▻ https://twitter.com/gravycatman ▻ Discord ...,PwUnWJ5p3mI
1291,FEEDING ALL MY 25 PETS!,"Download Amino and join me in the Reptiles community! iOS and Google Play: https://aminoapps.onelink.me/4eRt/ERBros Search ""Reptiles"" on the Explore ...",5M1Y7Jl1eHI
1292,Funniest Jealous Pets Ever Compilation 2018 | Funny Pet Videos,Some animals just don't like sharing the love. Come and watch this brand new compilation of the most jealous pets ever! We love to bring you the best videos on ...,yIpvA9CL2as
1293,DARK MATTER PETS VERZAMELEN !! | Roblox Pet Simulator #10,Join de Clonny Army!! Clonny Games hoodies in Roblox ➤ * Download hier de rode Clonny Games hoodie: ...,huND4F9jFiE
1294,Tik Tok Pets: Funny Cute Animals #33,"Tik Tok Pets: Funny Cute Animals #33 Video funny pets tik tok dog, cat, animals,.... Thanks for watching!",nlbkf4wtrdQ
1295,Soltei os agapornis e os cachorros na grama - Pets Na Net,Terrario 1 : http://www.dia7.com.br/pet-shop/terrario-para-snakes-hamster-camundongos-ourico-pigmeu- Terrario 2: ...,u0X3m4N2LXE
1296,KOALA - A Cute Koala Videos And Funny Koala Bear Compilation || PETS And ANIMALS,Check out these cute koala videos and funny koala videos in this koalas bear compilation. Koala bears are very cute and funny animals and pets. Thanks for ...,vvmMxju9xNE
1297,"Unboxing L.O.L. Pets Eye Spy, wave 2",Dati-mi si voi un follow pe Insta: @oanahasavlog.,XITfWIoG1k8
1298,The Secret Life Of Pets - Snowball Funny Moments HD,The Secret Life Of Pets - Best Snowball Funny Moments HD.,OyQXXWaMhBM
1299,NEW! Makeover Series LIL's Huge UNBOXING! Pets and Lil's Google Decides,"We are so excited to get out hands on the NEW Makeover Series LOL Surprise LILS! These are epic because not only do these LILS complete families, but you ...",J-Empe52e4I
1300,"""Spooktacular"" music on the largest pipe organ in the world!","We celebrated Halloween with some ""spooky"" music for the noon recital on October 31, 2018. Organist Scott Breiner played the following selections: ""PHANTOM ...",ucDGNZHssUE
1301,Introduction to the Pipe Organ,"This video provides a simple overview of the workings of the pipe organ and how it is played. Recorded at Sacred Heart Cathedral in Bendigo, Victoria, ...",NGNOopA4Qfc
1302,Pirates of the Caribbean - Davy Jones's theme cover church organ by Grissini Project,"Chuch organ cover of the Davy Jones's theme in Pirates of the Caribbean, performed by Grissini Project. Original music by Hans Zimmer.",D-_qS_3KXBA
1303,How Great Thou Art - Calvary Pipe Organ,How Great Thou Art arranged by Dan Miller and performed by John Cleaveland on the Calvary Grand Organ. For information about obtaining this arrangement ...,xrOIrSyDcCA
1304,Toccata and Fugue in D Minor (Best Version Ever),"Though the composition is public domain, the performance belongs to the record label that recorded the following performer (see YouTube's attributes in the full ...",ho9rZjlsyYY
1305,How an Organ Makes Music,"Duke University Chapel has three outstanding pipe organs, each in a different style, which are used for worship services, recitals and the study of organ ...",4S6BErQs-HE
1306,How come the organ has so many keys?,"The Rev. Dr. J. Richard Szeremany, Director of Worship, Music and the Arts East Liberty Presbyterian Church, Pittsburgh, PA Title: ""How come the organ has so ...",BuQqWeAbG34
1307,Demo of a Small Unit Pipe Organ,Demo of a portable two rank organ.,WC5GOSxii1Y
1308,Pipe Organ - Ride of the Valkyries,My (Josh Perschbacher) organ arrangement of Wagner's Ride of the Valkyries. Recorded on a 4 manual 108 rank 1927 Casavant rebuilt by Schantz in 2001 and ...,4x9QIt_fqQE
1309,Lady Gaga - Bad Romance. THE Official Pipe Organ Cover!,Celebrating Lady Gaga's 7th anniversary of Bad Romance on the king of instruments.,a9mgZqO4bgc
1310,How to make a wooden organ pipe - Part 1 of 3,Three part series showing the construction of a wooden organ pipe. Visit my website www.rwgiangiulio.com for more information.,-mibK_Dp-ZY
1311,Pipe Organ and Choir Music ~ Nascentia,Pipe Organ and Choir Music ~ Nascentia ♫ This track (and exclusive bonus material) is available for purchase on my website ...,pwXBANQpYRM
1312,Icons Among Us: The John R. Silber Symphonic Organ,"There aren't too many musical instruments large enough to walk through. But make your way to the Metcalf Ballroom, on the second floor of the George Sherman ...",QzIw25KnQjQ
1313,1914 Wurlitzer pipe Organ tour behind the scenes,This Wurlitzer Pipe Organ was taken out of the Liberty Theater in Seattle and reassembled in a church here in Spokane Wa. It is a masterpiece of ingenuity.,z2ihrcudFDE
1314,"ABANDONED CHAPEL, COMPLETELY UNTOUCHED WITH COLOURFUL PIPE ORGAN INSIDE","HELP SUPPORT ME AND MY CHANNEL AND BECOME A PATREON https://www.patreon.com/danielrobz Here I explore an abandoned chapel, completely ...",FC8HwI53qe0
1315,"Huge Pipe Organ in Small House, Michigan","Huge Pipe Organ in Small House, Michigan.",OZFetugnhyM
1316,"National Cathedral,Washington: Organ ""Processional  Rigaudon""","National Cathedral Address: Wisconsin and Massachusetts Ave., NW. Washington, D.C. Built/Founded: 1907 Architect: George Frederick Bodley The ...",0mIYn2EvnEE
1317,Pirates of the Caribbean,"Solo organ arrangement of a medley from Pirates of the Caribbean: The Curse of the Black Pearl. Includes the songs Fog Bound, The Medallion Calls, To the ...",JrMaRtF5rE8
1318,Pipe Organ Stops - St. John’s Seminary (Trip to New England - Part 3),"Come join me as I head off to St. John's Seminary in Brighton, Massachusetts to see the Andover Opus R-500 Organ (the renovated Hook & Hastings Opus ...",2VrUoGyGF-8
1319,Final Countdown Pipe Organ,Final Countdown by Europe on pipe organ improv by Mike Goldsmith.,iCf1pa9k6Xs
1320,Hans Zimmer - Interstellar themes on pipe organ,"Music from Interstellar, composed by Hans Zimmer, arranged by me. Recorded in St Maria church, Hamina, Finland This video was originally private because it ...",Esm-IWr4dcw
1321,Harry Potter - Hedwig's Theme on Pipe Organ - Esther Assuied,"Church organ transcription of Hedwig's Theme (Harry Potter), performed by Esther Assuied-Perez in Guérande (France). Original music by John Williams, based ...",i4rrn-V1O6A
1322,Home Pipe Organ Project Update 5/3/17,Another update with details on the room swap and my new ranks/3 Manual Kimball console. Check my website at: www.masonsshop.com.,l2yLzx-h84k
1323,The Pipe Organ - The Epic Mickey Files,"If you guys enjoy this and the other videos, come and support my work on Patreon, like the Animation Lookback page on Facebook, follow me on Twitter, watch ...",dQcL2sYYivY
1324,"Installation of Hybrid Pipe Organ for Mfantsipim School, Cape Coast","Installation of Hybrid Pipe Organ for Mfantsipim School, Cape Coast.",d0Vuu6u9o7Q
1325,Chicago's Best Organ Music: Ernest M. Skinner Pipe Organ,The Rockefeller Memorial Chapel located on the campus of the University of Chicago houses the largest pipe organ in the Midwest. The E. M. Skinner organ is ...,WPYIpf2Pl90
1326,Organ/Art Installation at St. Barnabas - Pipes & tuning,"This is the third of three videos showing the final stages of the installation of a Casavant organ at St. Barnabas on the Desert in Paradise Valley, AZ. The organ ...",8V43eZH33qU
1327,The Wanamaker Organ - Inside the world's largest operating musical instrument,"Most Philadelphians don't realize that the largest working musical instrument in the world is built into one of the city's landmarks, the former John Wanamaker ...",98KYMpBx9og
