,title,description,video_id
725,Nuevo evento UCL Dream League Soccer 2019 oficial copa de invierno ya disponible + dificultad,"Bienvenido a la descripcion! Compre las mejores y más baratas camisetas 18-19 en BS: http://bit.ly/2rcklWY, use el código: GIIODROID para obtener un 10% de ...",5ANXM_qspjA
726,Best Football Soccer Vines & Instagram Videos 2018,"Purchase the best Soccer, Basketball and Football cases. http://sportzcases.com?aff=184 Use Promo Code: SportVines For 10% Off!! I Hope You Enjoyed This ...",QGHgf6EWh2o
727,Soccer Stars The Perfect Way to Win netherland 8M | Rael VS SsLegend Youtuber,Soccer Stars Crazy Indirect Best Messi GOALS EVER! Rael VS SsLegend Youtuber Follow Me On Patreon If U Can Donate $$ even $1 to Make this channel ...,ssliUUAASRE
728,"New 2018 🔥 Soccer Football Vines ⚽️ Goals, Skills, Fails #187","football #soccer #footballvines ⚽   Best Football Goals, Skills 2018 Football Compilation - Dribles, Tricks, Goals, Saves, panna, futsal... Thanks for Watching!",uaig7IGpkDc
729,How to Get Recruited for College Soccer MY STORY,Hey guys! This is a video of me explaining how I got recruited for college soccer and some tips on what to do for the recruitment process. Comment with any ...,zigkrPmcV6s
730,"NEW 2018 🔥 Soccer Football Vines ⚽️ Goals, Skills, Fails #188","football #soccer #footballvines ⚽   Best Football Goals, Skills 2018 Football Compilation - Dribles, Tricks, Goals, Saves, panna, futsal... Thanks for Watching!",2ryUnPF3BjE
731,KIŞ KUPASI ETKİNLİĞİ BAŞLADI ! DREAM LEAGUE SOCCER 2019,Herkese Merhaba Arkadaşlar Ben Ayaz Game Tr kanalından Gökhan hepiniz kanalıma hoşgeldiniz bugün sizlerle Dream league Soccer 2019 da kış kupası ...,fa_SCfGvfIk
732,50 Famous Goals ● Impossible To Forget,"Title: 50 Famous Goals ○ Impossible To Forget Thank you for watching! If you enjoyed, please Subscribe us; http://bit.ly/Wrzzer Song: (HQ Version) Nalepa ...",bKOTKHtbM54
733,Dream League Soccer 2019 VS FIFA 19 Mobile | Penalty,"FIFA 19 Mobile vs Dream League Soccer 2019 Penalty. Na sua opinião, qual foi o melhor? Deixa aí nos comentários!",S2nDegzGuFk
734,Funny Soccer Football Vines 2018 ● Goals l Skills l Fails #73,Funny Soccer Football Vines 2018 ○ Goals l Skills l Fails Follow: https://www.instagram.com/433/ https://www.instagram.com/rldesignz/,xpwn2UWl75c
735,This Football Team BEAT ME UP After My Soccer match,"Playing kids at soccer match we played a football match and it was intense with alot of freestyle football skills like cristiano ronaldo, Neymar Jr & Kieran brown ...",qjG20tOacZw
736,Hướng Dẫn Hack Full Vàng Đội Hình Dream League Soccer 2019 Trên IOS,Id icloud http://megaurl.in/VgbG3JI Mk http://megaurl.in/xedix33 Page hack ios https://www.facebook.com/HackDreamLeagueSoccer2019IOS/ Facebook cá nhân ...,geU54KS9dwk
737,Soccer stars 🌠🗼France 5M🗼💲 Hard player😎 and Hard game😃🔝,X) the worst Remix ever But Great game :D and Great Player ;) X) music: Rock star Remix. ???? it's different - Shadow (feat. Miss Mary),iLeDZEG5iLg
738,NEW 2018 Funny Football Soccer Vines ⚽️ Fails | Goals | Skills [#180],"️Best Soccer Vines & Instagram Football Goals, Skills & Fails 2018 Football Compilation Thanks for Watching! Don`t forget to like and share the video!",zFabUo9Nx7o
739,"Hướng Dẫn Mở chế độ mới "" EVENTS "" Dream League Soccer 2019","Hướng Dẫn Mở chế độ mới "" EVENTS "" Dream League Soccer 2019 Để trải nghiệm chế độ EVENTS mới trong bản CẬP NHẬT Dream League Soccer 2019 ...",J-IeeYDx8TE
740,"Việt Nam Vô địch chế độ "" EVENTS "" Dream League Soccer 2019","Việt Nam Vô địch chế độ "" EVENTS "" Dream League Soccer 2019 Sau 9 trận đấu đã qua ở giải "" evennts "" trong Dream League Soccer 2019 Việt Nam đã giành ...",YcXf194OwoE
741,Funny Soccer Football Vines 2017 ● Goals l Skills l Fails #31,Funny Soccer Football Vines 2017 ○ Goals l Skills l Fails Funny football moments and football fails with insane football freestyle and soccer fails in calcio ...,tgmUcE_Kg3o
742,Como licenciar y poner kits y escudos en Dream League Soccer 2019 oficial todas las ligas del mundo,"Bienvenido a la descripcion! Mis canales y redes sociales: ✖Mi canal principal: https://www.youtube.com/channel/UCFPtkQrPxbtyOJ7EvRCBXSg ✖Mi canal ""El ...",5rGqIm0mhxc
743,Galatasaray Yaması + Online Maç ! Dream League Soccer 2019 | Android Gameplay Türkçe,First touch games tarafından geliştirilen dream league soccer 2019 ile karşınızdayım. Bu bölüm galatasaray takımı ile online 2 maç yaptım. Abone olmayı ...,1k5R2RTRGnA
744,Pes 2018 Pro Evolution Soccer Android Gameplay #116,Download the onefootball app for free http://tinyurl.com/y9r3ybua Pes 2018 Pro Evolution Soccer Description: NEW FEATURES TO MAKE MATCHES MORE ...,Odh8ZG2HZ48
745,Hack vàng Dream league soccer 2019 và mở khoá thị trường chuyển nhượng,Link APK Dream league soccer 2019 6.02 hack vàng và thị trường chuyển nhượng : https://123link.pro/z9zWB.,oUHDmssXHXc
746,"Việt Nam đại chiến chế độ ""EVENTS"" Dream League Soccer 2019","Việt Nam đại chiến chế độ ""EVENTS"" Dream League Soccer 2019 Trận đại chiến của Việt Nam - Tottenham trong chế độ mới EVENTS của Dream League ...",zc9bX7PoxDM
747,Hướng dẫn giảm lag Dream League Soccer 2019 đơn giản nhanh nhất SPORT GAME,Hướng dẫn giảm lag Dream League Soccer 2019 đơn giản SPORT GAME Welcome To My Channel Kênh của mình làm Clip và LiveStream các game về thể ...,84Qai_1qDoA
748,"New 2018 🔥 Soccer Football Vines ⚽️ Goals, Skills, Fails #186","football #soccer #footballvines ⚽   Best Football Goals, Skills 2018 Football Compilation - Dribles, Tricks, Goals, Saves, panna, futsal... Thanks for Watching!",_3lYOeCl_H8
749,"New 2018 🔥 Football Soccer Vines ⚽️ Goals, Skills, Fails #181","football #soccer #footballvines ⚽   Best Football Goals, Skills 2018 Football Compilation - Dribles, Tricks, Goals, Saves, panna, futsal... Thanks for Watching!",aCXG-j0yYJI
750,How Seashells Are Made,Learn more about CuriosityStream at https://curiositystream.com/reactions (CODE: reactions) If you know that seashells are made of basically the same stuff as ...,iUeMxjkSPyM
751,"Snorkeling for seashells in Navarre Beach, FL June 09, 2018","This is about 2 hours of snorkeling condensed down to 10 minutes. I'm snorkeling off of Navarre Beach, FL in shallow water near the shoreline. I'm using an 8 ...",izpUGCaptc4
752,Baseball's first curveball was thrown underhand and inspired by seashells,"In the early days of baseball, the role of the pitcher was more like that of a basketball ref at opening tip: get the action going and don't get cute. But as the sport ...",rqr4Wo_sudA
753,Thanksgiving Feast Of Seashells In Southwest Florida,Thanksgiving Feast Of Seashells In Southwest Florida To read and see the whole story... go to ...,4o9ctkQO3dY
754,🐚 A Collection of HUNDREDS of Seashells!! 🐚,Main Channel • https://www.youtube.com/serisims Follow the Vlog channel! • https://goo.gl/3JQehV So my Mom ADORES all things colorful and has recently ...,JZw2X_r1MaE
755,Sea Shells so beautiful (HD1080p),คำอธิบาย.,yACDdWYNit8
756,Sea Shells,"A sea shell is a hard, protective outer layer created by an animal that lives in the sea. The shell is part of the body of the animal. Empty seashells are often found ...",FoIHWFsdGGs
757,Bill Balo - SeaShells Hotel & Spa Phú Quốc - Thiên đường Maldives mới tại Việt Nam,Bill Balo - SeaShells Hotel & Spa Phú Quốc - Thiên đường Maldives mới tại Việt Nam Khách sạn 5 sao SeaShells Hotel & Spa Phú Quốc nằm ngay trung tâm thị ...,jGRYyXfD2-8
758,Finding the rarest sea shells ever in outer banks North Carolina!!!,In this video we found some of the rarest sea shells in the ocean that cannot normally be found. Don't forget to leave a LIKE and SUBSCRIBE ...,7WDdYK_MwB4
759,Gulf Coast Seashells,Description.,SE52CsbdNGw
760,Collecting Seashells In Clear Captiva Gulf,http://www.iloveshelling.com/blog/2012/10/13/turquoise-treasure-terrain/ Collecting Seashells in clear waters of Captiva Florida in the warm October waters of ...,j9CbqK880R0
761,How To Bring Back Color To Seashells.mov,http://www.iloveshelling.com/blog/2011/02/09/how-to-restore-color-to-your-seashells-tutorial/ Caution: Muriatic acid has controversy as to the damage it can do ...,P2J3GcX__88
762,Easy Gold-Leaf Seashells,be creativo Subscribe today and give the gift of knowledge to yourself or a friend Easy Gold-Leaf Seashells 1 : The Materials 2 : Apply the Sealer 3 : Coat with ...,ZRP86g1fKF4
763,My collection of shells/ Seashells from world largest sea beach cox's bazar,"Selected seashells from the list below: Alphabet Cone,Angel Wings,Angulate Periwinkle,Apple Murex,Atlantic Bubble,Baby's Ear,Banded Tulip,Beaded ...",zxPDqEbithk
764,"Southwest Florida Seashells - Naples, FL",Barbara Grove shows us some of the shells that can be found in Southwest Florida. Barb is one of the many wonderful volunteers at Delnor-Wiggins Pass State ...,DJCTQj8gGfc
765,Collecting seashells in seashells flooded santa monica beach,"Exploring beaches and Collecting seashells is one of my favorite things to do. Today's shore was breathtaking, crunching on seashells with every step.",w6w9Q3V1QL0
766,Burning Seashells With Gas Torch,,UuliWXfdFqY
767,sea shells 3d goldfish art By Gerardo Chierchia,please support me BY: https://www.paypal.me/gerardothanks Big Sea Shells fro Thailand painted with 3D goldfish artist Gerardo Chierchia from ...,TJI9MaSWABg
768,Sea Shells for Making Jewelry | Liz Kreate,Do you love gathering Sea Shells? Some Jewelry making ideas with Sea Shells. SEASHELLS - How to Grind Cut and Polish ...,Zz1iRxDceN4
769,"Snorkeling Navarre Beach, FL for seashells July 2016",Come explore under the sea with me as I snorkel for seashells in the Gulf of Mexico!,m6GhkrA6wH8
770,sea shells Arrangement/ Beautiful Home decor showpieces,easy ideas for seashells arrangement.,rXWtCWnxl2Q
771,SEASHELLS!!,"Today at the lounge, Uncle Larry makes something from his childhood! Subscribe to Joe's channel: ...",DeBxtUFT7ug
772,Seashells Tutorial part 1,three kinds of seashells made from fondant...,1wHzAH86F2Q
773,Survival Skills Cooking Seashells - Cooking Seafood,"Survival Skills Cooking Seashells - Cooking Seafood Thank you for all of your support, I can't wait to share this videos series with you.",v56C1btmiXU
774,SEASHELL CHRISTMAS ORNAMENTS I DIY - Vlog004,DIY Seashell Christmas Ornaments You will need: * Seashells * Acrylic gold paint or gold nail polish * Glue Gun * Thread * Ribbon * Glitter Very cute & easy to ...,XUzzDZnp0MM
775,🔊 intense ASMR 🐚 SEASHELLS sound! 🐠 🌊 🐟 NAILS-tapping & scratching! ~ new TINGLES! (outdoor video) 🐬,This is a binaural intense ASMR video in which I scratch and tap some seashells! ❖ I hope you like it and enjoy it...for your relax! Suggestions are always ...,vMcFs0CjQg4
776,Best Wall Hanging Craft Idea | Seashell Wall Hanging Making at Home | DIY Room Decor,"Here we are going to show you Best Wall Hanging Craft Idea, Seashell Wall Hanging Making at Home, DIY Room Decor. If you have a collection of beautiful ...",r-E7bRIKwHQ
777,Seashell Diversity! [ Specimen Saturday ],Today we dig through some of Seri's rather large collection of sea shells from all over the world to learn a bit about sea shells from all over the world!! ...,BbjvyyFJirU
778,Dig for Pre Hististoric Seashells & Dino Skull on Fun House TV,"If you like adventure, exploring, finding all cool things from the earth, nature and far- away lands then welcome to Fun House TV. Each week we go out on ...",I8SOlOrsZsg
779,Swordfish Takes Away Seashells Strawberry While Sleeping + More Baby Shark Songs & Cartoons,Swordfish Takes Away Seashells Strawberry While Sleeping. Police Shark Comes to Help. Plus More Baby Shark Kids Songs & Cartoons for Children. #ukidstv ...,CiSnf3F3Lhc
780,How to Paint on Seashells ♥ Sinister Siren Shell Craft ♥ Gothic Halloween Costume DIY #sirens,How to Paint on Seashells | Sinister Siren Shell Craft | Gothic Halloween Costume DIY ♥ Are you making a Siren Costume for Halloween? Or are you going to ...,qj2ZorHC7xU
781,The Ocean 3D Printed a Seashell!! (Looking Through Microscope at Seashells),"In this video, I looked very close at some seashells! I got them from a trip that we took to Florida! It was fun to visit the state and ""sea"" the Oceans (Pun Intended) ...",RMJzFMYySbg
782,"Fortunes Rocks Beach, Biddeford, Maine - Seashells","A quiet, beautiful beach to walk and comb for shells and other treasures.",jztQnmYwfmc
783,Seashells,A display of seashells from around the world.,dZbp04P4GHM
784,COLLECTING ''100'' SEASHELLS/ KIDS BEACH DAY / SCHOOL SEASHELL PROJECT/ 100th DAY OF SCHOOL,KIDS BEACH DAY/COLLECTING ''100'' SEASHELLS/ SCHOOL SEASHELL PROJECT/ 100th DAY OF SCHOOL/ Today we when to the beach to collect (Sea ...,6nasgYQGh4s
785,How to clean and polish seashells,Step by step directions on how to clean and polish seashells to make their colors come back again.,Xj2ATd73-4w
786,How to store and display seashells !  Sea shell Collection,This video will show you how to store correctly you seashells ! Beware of the 4 enemies of seashells ! You wil be able to store them for many years if you respect ...,d_vXunucsus
787,Polishing seashells w/out using muriatic acid that dangerous to your health,seashells #collection.,oRpWrWQb00w
788,Hawaiian sea shells: HUMPBACK AND RETICULATED COWRIES,"Featured in this video...Humpback and reticulated cowries that I found on Oahu, Hawaii on Tuesday, Dec 23, 2008. Both were given to my 6 year old daughter, ...",IgmaR03GVE4
789,Florrie - Seashells at T in the Park 2014,Florrie performs Seashells at T in the Park 2014.,o7ZMbOdYpKo
790,Johan Vilborg   Seashells Original Mix,,tAnivtv_nK4
791,How to make beautiful RESIN SEA SHELLS  - Video 3,Video 3 Using the molds to make resin sea shells. Now that you have made some molds lets use them. I am using the product ART RESIN. I will show you step ...,lmlm4_M4ntI
792,Seashell Snowflake Ornament ♥ 12 DIYs of Christmas,"In this video I show you another fun way to turn part of your seashell collection into a snowflake ornament. I have a huge collection of seashells, and I love to ...",EEm3uUgZ3jI
793,How to find golden seashells and more on trove,Hi guys im showing you how to find golden seashell and more SHAREfactory™ https://store.playstation.com/#!/en-us/tid=CUSA00572_00.,Faw-bsprduY
794,Dollar Tree Christmas Crats: Dollar Tree Seashell Ornament,"Hey y'all! In this video, I'll show you how to make an awesome Dollar Tree seashell ornament! Check me out: Website: http://www.ThisSouthernGirlCan.com ...",Te69Dxdfw_o
795,DIY 5 different ways to decorate seashells shells,Website :http://upcycledecoupage.com/2017/10/05/diy-5-ways-to-decorate-your-seashells/,qecbXY0BATY
796,Midnite - Seashells,CURRENT.,K8oM2CoYjiI
797,"Seashells, Sea plants, Corals - Watercolor Postcard and Finally... (Reupload nr 2 - Oh, Dear)","""Seashells, Sea Plants, Corals""- Design, video, content © SVVA jewels, more info below. Hi everyone! These past four (or maybe six??) weeks I've been working ...",ifl0nXeea5M
798,"Seashells Hotel & Spa Phu Quoc, Vietnam (Asia). The best of Seashells Hotel & Spa Phu Quoc","Seashells Hotel & Spa Phu Quoc, Vietnam (Asia). The best of Seashells Hotel & Spa Phu Quoc Hotel. Welcome to Seashells Hotel & Spa Phu Quoc, Vietnam ...",1w9uXMnfM4c
799,FINDING SEASHELLS!,MAIN CHANNEL*** https://www.youtube.com/c/karleesteeel Younow: https://www.younow.com/KarleeSteel Twitter: https://twitter.com/karlees...,-vr0pmb5Xug
800,Real Estate For Beginners,"Real estate has a language to it. And if you understand some of the most important basic words and principles, it can help you understand how to make a lot of ...",D69VhdRNok0
801,My First Year Earnings As A Real Estate Agent [ACTUAL NUMBERS],"In this video, I'm showing the real dollar amount of money that I made in my first year as a real estate agent. I show you the actual figures and transactions I did ...",eOyjl5gBNVg
802,What Does a Real Estate Agent Do?,"What does a Real Estate agent actually do? What are some of there job duties? Explained here.. My podcast - Supreme Being - Available on Spotify, iTunes, ...",KZ4tc-X6Cbc
803,Chatting with a 22-year-old Real Estate Millionaire,Igor's insta ▷ http://www.instagram.com/whoiskaj My insta ▷ http://www.instagram.com/mrhales109 Have you tried Airbnb? Sign up with my link and you'll get ...,KTKoNEWqbBI
804,"Earning $7,000 vs $220 in a Day: Real Estate Agent & Pool Cleaner",What does it look like to earn $7000 in a day vs. $220? Spend a day with Chase and Ronnie as we track their incomes and they share their thoughts on money.,qA8CocdtuJA
805,Real Estate Investing for Beginners: Expectation vs Reality,"Let's debunk some common myths about real estate investing, and share what it's ACTUALLY like, no sugar coating - enjoy! Add me on Snapchat / Instagram: ...",EFaOBKSfweA
806,Retire In 5 Years With Real Estate,Do you ever dream of retiring young? Wouldn't that be the dream? Real estate has done that for me and I want to share with you how you could retire in 5 years ...,OT4IPUXBsG8
807,15 Things You Didn't Know About The Real Estate Industry,15 Things You Didn't Know About The Real Estate Industry | Industry Wednesday SUBSCRIBE to ALUX: ...,H317_gABbT8
808,Using Home As ATM HIGHEST Since 2007! Global Real Estate SLOWDOWN From U.S. To Hong Kong!,LOOK THROUGH MY BOOKS! http://books.themoneygps.com SUPPORT MY WORK: https://www.patreon.com/themoneygps PAYPAL: https://goo.gl/L6VQg9 ...,UgdemqI716M
809,DANGER: Prepare for The 2019 Real Estate Market,"Prepare for The 2019 Real Estate Market. Will the housing market / bubble CRASH, CORRECT, or CONTINUE? What are the odds of each? We'll talk about ...",Ytb212CajTU
810,"Harry Dent Recaps Trip to Australia, Talks Real Estate","Just returning from his recent trip to Australia, Economist, Harry Dent recaps his tour and conversations about the country's demographics, real estate and other ...",_wTzMKV-BhQ
811,Is the Real Estate Market Going to Crash?,Is the Real Estate Market Going to Crash? Visit the Dave Ramsey store today for resources to help you take control of your money! https://goo.gl/gEv6Tj Become ...,WohNlOW45wY
812,Common Mistakes To Avoid Your FIRST Year As A Real Estate Agent,There are many mistakes people make their first year in Real estate... let's talk about the biggest 3 to avoid all together! Enjoy www.bcbundle.com - Black Friday ...,zTLtufTLCq8
813,President Donald Trump Tweets He 'Lightly Looked' At Real Estate Project | Morning Joe | MSNBC,"In tweets from Friday, the president while in Argentina defended looking at a real estate project in Russia at the same time he was securing the nomination for ...",xgmTPL0ndEI
814,What Is The Best Real Estate Investing Strategy?,"In a short period of time, real estate investment started to change my life in so many ways. And if you're here because you want to pursue real estate but you ...",tWRRuj9mhJ4
815,Getting Into Real Estate As a Beginner,I get a lot to share how I got started in real estate. So I share how it all began and what has inspired and motivated me to create this self made success. Through ...,LdAqhHlYg1E
816,Cold Calling LIVE (New Real Estate Agent),"This is Valerie making some calls, LIVE. She is our newest edition to the team and what better way to get introduced to this business than hop on the phones ...",rHE7uZjdum0
817,Wholesaling Real Estate | How to start with $1000,I talk about how to start wholesaling with only $1000. I also talk about why you don't really need any money to start wholesaling. GET YOU EVENT TIX HERE: ...,bPITNAvtDzQ
818,Day in the Life: Real Estate Agent,"Follow me in the day of the life of a real estate agent and explore / deal with over $6000000 in real estate ($450k listing, $700k listing, $2275000 buy-deal, ...",cQJYPdGleRc
819,Home Sales DROPPING FAST as Inventory RAPIDLY Builds! Real Estate Weakest Since Crisis!,LOOK THROUGH MY BOOKS! http://books.themoneygps.com SUPPORT MY WORK: https://www.patreon.com/themoneygps PAYPAL: https://goo.gl/L6VQg9 ...,b6FEeHtGOc8
820,WHY REAL ESTATE IS THE GREATEST CAREER IN THE WORLD | Ryan Serhant Vlog #006,Ryan Serhant vlog #006 Connect with Ryan Serhant here: Instagram: http://instagram.com/RyanSerhant Facebook: http://facebook.com/RyanSerhant Twitter: ...,1YEGEDPZwQM
821,The ULTIMATE Beginner's Guide to Investing in Real Estate Step-By-Step,"Here's a Real Estate beginner tutorial where I can really cover the blueprints and outline the basics of what's needed in order to prepare for, and actually invest ...",VXeaU0i54H0
822,Real Estate - Darling (Official Video),"Real Estate - “Darling” from 'In Mind', released 2017 on Domino Record Co. Subscribe to Real Estate on YouTube: http://bit.ly/RealEstateYT Find 'In Mind' on ...",VUFr4SK1-l4
823,How to Respond To Low Budget Clients in Real Estate : Sanat Thakur,I have answered here the query of my regular viewer. What to do when client gives low offer than your asked price. How to handle his queries and convince him.,4PEqpBzbxaI
824,Best 2019 Real Estate Strategies To Revisit,"Best 2019 Real Estate Strategies To Revisit In todays video we touch on foreclosures, subject to , and short sales briefly look at why these strategies are looking ...",TT35reMYELI
825,Inside Secrets of a Real Estate Agent,"""You think the shark tank is brutal - wait till you see this,"" said realty maven Barbara Corcoran.",jyze_lz6uDw
826,Have Real Estate Pay For Your Lifestyle,"Real estate is my main source of income and it has blessed me with a life that I've always dreamed of. Real estate is different from other investments, it pays you.",oVsyZqz64PA
827,Wholesaling Real Estate | Ebert Project is Finally Done!,Francis goes over the completed Ebert house and the things that we did to really add value to the house. Game Changing Software My Team & I Created: www.,HHEcHqEUeWQ
828,The Reality of Real Estate Investing for Beginners | Ryan Serhant Vlog #039,Real Estate Investing for beginners can be overwhelming and confusing. Ryan Serhant gives advice for anyone getting started in Real Estate and how you can ...,XtwB7AL5vHA
829,Wholesaling Real Estate | The Ugly House SOLD,I take you on a day of running around getting errands done and finishing up some projects before heading out of town. Game Changing Software My Team & I ...,TDHUnBnYoNg
830,10 Tips to CRUSH it in Real Estate - New Agents MUST watch,Here are 10 ways how you can crush it in real estate specially if it'll be your first year! MY PRODUCTS: http://bit.ly/2utjsw5 SCRIPTS: The Book of Yes: ...,wXg50Q1jO0U
831,Luxury Single Family Home And Real Estate For Sale  | Lovely Tiny House,LUXURY SINGLE FAMILY HOME AND REAL ESTATE FOR SALE PRICE: $730000 2 BEDROOMS 2 FULL BATHS 1284 SQ. FT. Interior: 1284 sq. ft. (approx.),w0M01Btd1H4
832,Benefits of International Real Estate Ownership,"https://www.nomadcapitalist.com Why is foreign real estate investment such a great idea to consider? Investing in real estate overseas offers a range of benefits, ...",dD2DzHpbPRs
833,How to Make Money From Real Estate Business ?,How to Make Money From Real Estate Business ? In this movie we will guide you how you can make money from Real Estate Buiness in Pakistan. Some Tips ...,qeSZAI0z7SQ
834,REAL ESTATE INVESTMENT ON THE BLOCKCHAIN | SWINCA ICO REVIEW,Welcome to Crypto Chemist. SWINCA aims to disrupt the Crypto Real-Estate industry by lowering the barrier and become a multi-properties owner of worldwide ...,cXv-fJXylOw
835,How to Get Started in Real Estate with Grant Cardone,Our offerings under Regulation D Rule 506(c) are available to accredited investors only. For our Regulation A offering: Until such time that the Offering Statement ...,xiIizvKvQmc
836,Mark Whitten Talks Strategies To Invest In Real Estate & Flipping Houses,Listen LIVE: http://power1051fm.com/ ▻ Facebook: https://www.facebook.com/Power1051NY/ ▻ Twitter: https://twitter.com/power1051/ ▻ Instagram: ...,R4CXaZYTm14
837,How To Use Real Estate To Buy A Car,"I'm very blessed to have my passion create financial freedom for me and if you ask me what real estate pays for, I can say that it pays for my living. In this video ...",L3qUfnt6wI8
838,Global Real Estate Slowdown HAS BEGUN From the U.S. to Canada to Australia to the UK!,LOOK THROUGH MY BOOKS! http://books.themoneygps.com SUPPORT MY WORK: https://www.patreon.com/themoneygps PAYPAL: https://goo.gl/L6VQg9 ...,hZFrTOjLzWU
839,IS THE REAL ESTATE MARKET CRASHING IN 2019?,Today we have a discussion if the real estate market is crashing. I am seeing a lot of youtube videos lately around real estate crashing in 2018. Meet Kevin has ...,1EUMcsNOP7E
840,The TRUTH about Fundrise Real Estate Investing,Fundrise. Real Estate Investing with some pretty substantial returns. Is it worth it? Is it legit? Should you invest in it? Here's what I discovered. Enjoy! Add me on ...,fVIe1pBtfZ8
841,Getting Into Real Estate At Age 21,I've got a question from one of my viewers and he's asked me about getting into real estate at 21. Allow me to share with you some thoughts based on my ...,HK5JEPwndbw
842,Online Trading Academy: Learn more about OTA Real Estate.,Be one of the first 25 callers to receive two free tickets to a OTA Real Estate half-day class!,h0g9f-titXw
843,How to Pass the Real Estate License Exam - Tips,PREP AGENT EXAM PREP: https://aff.prepagent.com/SHL PREP AGENT 20% OFF CODE: LOIDA Hi everyone! Here are some tips on the entire process from ...,_L89ibE_ZJs
